{
  "version": "1.0.0",
  "metadata": {
    "architecture": "hailo15l",
    "content_hash": "0083c93de0ab73302a36531d6cebc41586232f470e4f166e7865630d7c911cf9",
    "description": "",
    "generation_timestamp": "2025-11-24T12:15:22.698088+00:00"
  },
  "dis": {
    "angular_dis": {
      "enabled": false,
      "vsm": {
        "height": 1080,
        "hoffset": 1856,
        "max_displacement": 64,
        "voffset": 1016,
        "width": 1920
      }
    },
    "average_luminance_threshold": 0,
    "black_corners_correction_enabled": true,
    "black_corners_threshold": 0.5,
    "camera_fov_factor": 0.85,
    "debug": {
      "fix_stabilization": false,
      "fix_stabilization_latitude": 0.0,
      "fix_stabilization_longitude": 0.0,
      "generate_resize_grid": false
    },
    "decrement_coefficient_threshold": 0.001,
    "enabled": false,
    "increment_coefficient_threshold": 0.01,
    "minimun_coefficient_filter": 0.1,
    "running_average_coefficient": 0.033,
    "std_multiplier": 3.0
  },
  "eis": {
    "camera_fov_factor": 0.85,
    "eis_config_path": "/home/root/apps/resources/final_calibration.json",
    "enabled": false,
    "hdr_exposure_ratio": 0.2,
    "iir_hpf_coefficient": 0.997,
    "line_readout_time": 15151,
    "max_angle_deg": 6.0,
    "min_angle_deg": 0.05,
    "rotational_smoothing_coefficient": 0.0,
    "stabilize": true,
    "window_size": 10
  },
  "gyro": {
    "enabled": false,
    "scale": 0.000152716,
    "sensor_frequency": "833.000000",
    "sensor_name": "lsm6dsr_gyro"
  }
}
